{
  "state": "clear",
  "since": null,
  "stoppedAt": null,
  "detectedAt": null,
  "clearSince": "2026-10-08T21:26:33.250Z",
  "lastReadingAt": "2026-10-08T21:40:00.000Z",
  "sensor": {
    "name": "Crossing node",
    "batteryOk": true
  },
  "nodeIds": ["node-a"],
  "alertMode": "blockedAndCleared",
  "updatedAt": "2026-10-08T21:40:00.090Z"
}
